[{"band":"exemplary","dimensions":{"architecture_decisions":15,"ci_workflow":20,"dependencies":0,"documentation":10,"evidence_confidence":15,"governance":15,"package_manifest":15},"evidence_refs":["evidence:08ca8f0cd96a01443445b6387276901fbaf327dffc2300a6db16a341bf1959ef","evidence:2b5e0a5f4722f1f0912ed76f4154d926770011124bcbddbc892f04c67c9d4b15","evidence:557d52b82c0b9cf39a92ad68dc6f894ce490cfced8974cea75adcd3eea642d8e","evidence:77ea38aad92ee15e35e79e63a72d6bf1578f61a214f76d96efe25ccbcbd4412c","evidence:9745cf9f5aa2a55d0d0ec956f595a9102051224f6da654c5e756128b06ba6c50","evidence:ad85781ad2fab7fd28d63dd6e14ddbc6fa1d3b54ce1978223c93bc704ae485e5","evidence:d2338cd112c2b2367b1e129321fa71b7ea910795b0328749b40ebc0e454cd0e6"],"maximum_score":100,"profile_id":"foundational-maturity","profile_version":"1.0.0","score":90,"subject_id":"repo:l9-gate-sdk"},{"band":"mature","dimensions":{"architecture_decisions":0,"ci_workflow":20,"dependencies":10,"documentation":10,"evidence_confidence":15,"governance":0,"package_manifest":15},"evidence_refs":["evidence:053ade54eab180cfb6442885f9b719e70855791f3ca2005aaf8172f26077af5a","evidence:69a738878ad517887bb645a85d8020726f36ac3d8c9b988befd492ab82c9f402","evidence:8f4331cf9239c6121cb63ea3568998cdf31f0cf1cc1beef54201ac03d6ebd525","evidence:944d594375fc539e595d57462092de4c3af2837ec28ab2be4712373efd08be46","evidence:c87556ab9f0ac784f89a55b400f8a6c61be905b44e23f5d40e47aaa6c4a376a5","evidence:d538fed45f2e9814b7540a1928f642f4a07c1f6babca0d515e02a58b027be91a"],"maximum_score":100,"profile_id":"foundational-maturity","profile_version":"1.0.0","score":70,"subject_id":"repo:l9-mcp-server"}]
